{
  "registry": "diagnostics",
  "edition": "1",
  "previousEdition": null,
  "status": "provisional",
  "entries": [
    { "id": "aas.json.raw-bytes-required", "kind": "diagnostic", "owner": "AAS normative maintainers", "contact": "GOVERNANCE.md", "status": "provisional", "semanticAuthority": "spec/identity.md#2-strict-i-json-input-profile", "introducedEdition": "1", "vectors": ["vectors/json/negative/raw-bytes-required.json"], "collisionReview": "Private provisional diagnostic; not active, public, or qualified." },
    { "id": "aas.example.ok", "kind": "diagnostic", "owner": "AAS normative maintainers", "contact": "GOVERNANCE.md", "status": "provisional", "semanticAuthority": "spec/policy-and-enforcement.md#10-stable-agent-diagnostic-contract", "introducedEdition": "1", "vectors": ["vectors/schema/positive/result.json"], "collisionReview": "Private provisional example success diagnostic used only by the exact result vector." },
    { "id": "aas.json.input-too-large", "kind": "diagnostic", "owner": "AAS normative maintainers", "contact": "GOVERNANCE.md", "status": "provisional", "semanticAuthority": "spec/identity.md#2-strict-i-json-input-profile", "introducedEdition": "1", "vectors": ["vectors/json/negative/input-too-large.json"], "collisionReview": "Repository-controlled provisional namespace." },
    { "id": "aas.json.depth-exceeded", "kind": "diagnostic", "owner": "AAS normative maintainers", "contact": "GOVERNANCE.md", "status": "provisional", "semanticAuthority": "spec/security-and-conformance.md#6-resource-limits-and-privacy", "introducedEdition": "1", "vectors": ["vectors/json/negative/depth.json"], "collisionReview": "Repository-controlled provisional namespace." },
    { "id": "aas.json.duplicate-key", "kind": "diagnostic", "owner": "AAS normative maintainers", "contact": "GOVERNANCE.md", "status": "provisional", "semanticAuthority": "spec/identity.md#2-strict-i-json-input-profile", "introducedEdition": "1", "vectors": ["vectors/json/negative/duplicate-key.json"], "collisionReview": "Repository-controlled provisional namespace." },
    { "id": "aas.json.invalid-utf8", "kind": "diagnostic", "owner": "AAS normative maintainers", "contact": "GOVERNANCE.md", "status": "provisional", "semanticAuthority": "spec/identity.md#2-strict-i-json-input-profile", "introducedEdition": "1", "vectors": ["vectors/json/negative/bom.json"], "collisionReview": "Repository-controlled provisional namespace." },
    { "id": "aas.json.invalid-syntax", "kind": "diagnostic", "owner": "AAS normative maintainers", "contact": "GOVERNANCE.md", "status": "provisional", "semanticAuthority": "spec/identity.md#2-strict-i-json-input-profile", "introducedEdition": "1", "vectors": [], "collisionReview": "Repository-controlled provisional namespace." },
    { "id": "aas.json.invalid-number", "kind": "diagnostic", "owner": "AAS normative maintainers", "contact": "GOVERNANCE.md", "status": "provisional", "semanticAuthority": "spec/identity.md#2-strict-i-json-input-profile", "introducedEdition": "1", "vectors": ["vectors/json/negative/fraction.json"], "collisionReview": "Repository-controlled provisional namespace." },
    { "id": "aas.schema.unknown-id", "kind": "diagnostic", "owner": "AAS normative maintainers", "contact": "GOVERNANCE.md", "status": "provisional", "semanticAuthority": "schemas/readme.md", "introducedEdition": "1", "vectors": [], "collisionReview": "Repository-controlled provisional namespace." },
    { "id": "aas.schema.duplicate-id", "kind": "diagnostic", "owner": "AAS normative maintainers", "contact": "GOVERNANCE.md", "status": "provisional", "semanticAuthority": "schemas/readme.md", "introducedEdition": "1", "vectors": [], "collisionReview": "Repository-controlled provisional namespace." },
    { "id": "aas.schema.alias-id", "kind": "diagnostic", "owner": "AAS normative maintainers", "contact": "GOVERNANCE.md", "status": "provisional", "semanticAuthority": "schemas/readme.md", "introducedEdition": "1", "vectors": ["vectors/schema/catalog-corpus.json"], "collisionReview": "Private provisional diagnostic; not active, public, or qualified." },
    { "id": "aas.schema.network-ref", "kind": "diagnostic", "owner": "AAS normative maintainers", "contact": "GOVERNANCE.md", "status": "provisional", "semanticAuthority": "schemas/readme.md", "introducedEdition": "1", "vectors": [], "collisionReview": "Repository-controlled provisional namespace." },
    { "id": "aas.schema.ref-cycle", "kind": "diagnostic", "owner": "AAS normative maintainers", "contact": "GOVERNANCE.md", "status": "provisional", "semanticAuthority": "schemas/readme.md", "introducedEdition": "1", "vectors": [], "collisionReview": "Repository-controlled provisional namespace." },
    { "id": "aas.schema.invalid", "kind": "diagnostic", "owner": "AAS normative maintainers", "contact": "GOVERNANCE.md", "status": "provisional", "semanticAuthority": "schemas/readme.md", "introducedEdition": "1", "vectors": [], "collisionReview": "Repository-controlled provisional namespace." }
  ],
  "changes": ["Initial bounded diagnostics for strict JSON and offline schema ingestion."]
}
